<!ELEMENT Universidad (Alumnos)>
<!ELEMENT Alumnos (Alumno+)>
<!ELEMENT Alumno (ID,Nombre,Carrera,Materia_1,Materia_2,Calificacion1,Calificacion2)>
<!ELEMENT Nombre (#PCDATA)>
<!ELEMENT ID (#PCDATA)>
<!ELEMENT Carrera (#PCDATA)>
<!ELEMENT Materia_1 (#PCDATA)>
<!ELEMENT Materia_2 (#PCDATA)>
<!ELEMENT Calificacion1 (#PCDATA)>
<!ELEMENT Calificacion2 (#PCDATA)>